{
  "author": {
    "kind": "agent",
    "label": "External packet simulator",
    "toolName": "public-api-fixture",
    "toolVersion": "1.0.0"
  },
  "briefDigest": "sha256:9ffa909b428e21dd78db8730780cebaa006707828c47e888a715cb5249d16af4",
  "candidateDigest": "sha256:3dbcc10cea8d6d22acd2ec656656675ba858d995d66cff87644aae77baaaaee2",
  "candidateId": "candidate-a",
  "claims": [
    {
      "category": "small-size",
      "message": "The supplied renders are intended for multi-artifact review.",
      "severity": "note"
    }
  ],
  "materials": [
    {
      "digest": "sha256:52a369511a59955bf5153e0f3f0259a38818a18084e1c8480a4e1aadd448c799",
      "identifier": "agent-rationale",
      "kind": "external-claim"
    },
    {
      "digest": "sha256:02baceb7084d7fc8a1cb9f58089e83259ac22e908bea3a86c4db4e688e629e16",
      "identifier": "candidate-a-render",
      "kind": "tfsb-rendered"
    }
  ],
  "proposal": {
    "kind": "derive",
    "selection": {
      "kind": "recipes",
      "recipeIds": [
        "mark-small"
      ]
    }
  },
  "qaSummary": {
    "status": "unavailable"
  },
  "rationale": "Use profile: compact and align / center while keeping plan authority in TFSB.",
  "revision": 1,
  "schema": "tfsb.design-candidate",
  "schemaVersion": 1,
  "title": "Recipe-directed Café candidate",
  "visualEvidence": [
    {
      "artifacts": [
        {
          "byteLength": 82,
          "bytesBase64": "iVBORw0KGgoAAAANSUhEUgAAABAAAAAQCAYAAAAf8/9hAAAAGUlEQVR4nGMQVDJuoAQzjBowasCoAcPFAACgXuYBD4KZjgAAAABJRU5ErkJggg==",
          "decodedPixelDigest": "sha256:e5ab37b1d73edaf2a95de70af5057c2377d37e8d0641feecfc581869ec3bf789",
          "encoding": "base64",
          "height": 16,
          "mediaType": "image/png",
          "pngDigest": "sha256:91c35429c3e0547842b113c93e23f42676ba579030153b248c06b06c0d1c38a1",
          "role": "before",
          "width": 16
        },
        {
          "byteLength": 82,
          "bytesBase64": "iVBORw0KGgoAAAANSUhEUgAAABAAAAAQCAYAAAAf8/9hAAAAGUlEQVR4nGMQVDJuoAQzjBowasCoAcPFAACgXuYBD4KZjgAAAABJRU5ErkJggg==",
          "decodedPixelDigest": "sha256:e5ab37b1d73edaf2a95de70af5057c2377d37e8d0641feecfc581869ec3bf789",
          "encoding": "base64",
          "height": 16,
          "mediaType": "image/png",
          "pngDigest": "sha256:91c35429c3e0547842b113c93e23f42676ba579030153b248c06b06c0d1c38a1",
          "role": "after",
          "width": 16
        }
      ],
      "brandSystemDigest": "sha256:0000000000000000000000000000000000000000000000000000000000000000",
      "configuration": {
        "background": "transparent",
        "height": 16,
        "width": 16
      },
      "difference": {
        "changedBounds": null,
        "changedPixels": 0,
        "claim": "pixel-equal-for-this-renderer-and-case-only",
        "maximumChannelDelta": 0
      },
      "evidenceDigest": "sha256:52a369511a59955bf5153e0f3f0259a38818a18084e1c8480a4e1aadd448c799",
      "kind": "brand-diff",
      "projectDigest": "sha256:0000000000000000000000000000000000000000000000000000000000000000",
      "renderer": {
        "id": "resvg-png-v1",
        "platformClaim": "darwin-arm64",
        "qualificationId": "sha256:4bb08e677b87ef1ca74c35c5c22f547cebef4c22a1f98a08a9246fd9397d0f11",
        "version": "2.6.2"
      },
      "schema": "tfsb.studio-visual-evidence",
      "schemaVersion": 1,
      "sourceDigest": "sha256:0000000000000000000000000000000000000000000000000000000000000000",
      "target": {
        "assetId": "brand-wordmark",
        "canonicalAssetDigest": "sha256:0000000000000000000000000000000000000000000000000000000000000000",
        "svgDigest": "sha256:0000000000000000000000000000000000000000000000000000000000000000"
      }
    },
    {
      "artifacts": [
        {
          "byteLength": 82,
          "bytesBase64": "iVBORw0KGgoAAAANSUhEUgAAABAAAAAQCAYAAAAf8/9hAAAAGUlEQVR4nGMQVDJuoAQzjBowasCoAcPFAACgXuYBD4KZjgAAAABJRU5ErkJggg==",
          "decodedPixelDigest": "sha256:e5ab37b1d73edaf2a95de70af5057c2377d37e8d0641feecfc581869ec3bf789",
          "encoding": "base64",
          "height": 16,
          "mediaType": "image/png",
          "pngDigest": "sha256:91c35429c3e0547842b113c93e23f42676ba579030153b248c06b06c0d1c38a1",
          "role": "current",
          "width": 16
        }
      ],
      "brandSystemDigest": "sha256:0000000000000000000000000000000000000000000000000000000000000000",
      "configuration": {
        "background": "transparent",
        "height": 16,
        "width": 16
      },
      "evidenceDigest": "sha256:02baceb7084d7fc8a1cb9f58089e83259ac22e908bea3a86c4db4e688e629e16",
      "kind": "project-render",
      "projectDigest": "sha256:0000000000000000000000000000000000000000000000000000000000000000",
      "renderer": {
        "id": "resvg-png-v1",
        "platformClaim": "darwin-arm64",
        "qualificationId": "sha256:4bb08e677b87ef1ca74c35c5c22f547cebef4c22a1f98a08a9246fd9397d0f11",
        "version": "2.6.2"
      },
      "schema": "tfsb.studio-visual-evidence",
      "schemaVersion": 1,
      "target": {
        "assetId": "brand-mark",
        "canonicalAssetDigest": "sha256:0000000000000000000000000000000000000000000000000000000000000000",
        "svgDigest": "sha256:0000000000000000000000000000000000000000000000000000000000000000"
      }
    }
  ]
}
